subject,level,job_title,function_code,manager,emp_id,question,summary,start_timestamp,end_timestamp,duration
Alice Johnson,Level 2,Vice President,GPE,Tiju,103.0,question1,"Alice has consistently demonstrated exceptional leadership and project management skills, successfully leading multiple high-impact projects that enhance the company's market position. Her strategic vision and organizational prowess enable her to manage cross-functional teams effectively, delivering projects on time and driving measurable results. Alice's ability to coordinate diverse talents is a significant asset, inspiring her team and contributing to successful outcomes and overall business growth. Her analytical skills have also led to significant cost reductions by identifying efficiencies, showcasing her commitment to excellence and impactful change. Her contributions are vital in achieving organizational goals.",2024-10-21 10:40:49.202,2024-10-21 10:40:51.689,2.486992
,,,,,,question2,"Alice demonstrates exceptional leadership by promoting a collaborative and inclusive environment, encouraging creativity and idea-sharing. Her approach fosters a positive work culture, enhancing team morale and productivity. Alice's emphasis on teamwork leads to innovative solutions and successful project outcomes, benefiting the organization significantly. Her ability to create a space where team members feel valued and motivated contributes to overall company success and impact.",2024-10-21 10:40:51.689,2024-10-21 10:40:53.069,1.379905
,,,,,,question3,"Alice is encouraged to expand her technical skills to enhance her leadership and better support her team, particularly in specialized areas. By understanding emerging market trends, she can anticipate industry shifts and adjust strategies proactively, maintaining the firm's competitive edge. Her growth in technical expertise will help her navigate complex technologies and provide stronger support to both her team and the organization. Additionally, by gaining market insights, Alice will make informed strategic decisions that align with company goals, ensuring continued competitiveness and impactful contributions to the team and company.",2024-10-21 10:40:53.069,2024-10-21 10:40:54.907,1.837795
,,,,,,question4,"Alice should enhance her financial acumen and strategic planning skills to prepare for higher-level leadership roles. By developing these areas, she will be equipped to make informed decisions that align with the firm’s financial goals and vision. Improving her financial expertise will enable her to contribute effectively to budget planning and resource allocation. Strengthening her strategic planning capabilities will position her as a key decision-maker, allowing her to develop long-term strategies that support the company's objectives. These enhancements will increase her impact on the team and overall contributions to the company’s success.",2024-10-21 10:40:54.907,2024-10-21 10:40:57.414,2.507212
Bob Brown,Level 5,Senior Manager,IS,Saqib,104.0,question1,"Bob has demonstrated exceptional leadership and project management skills, playing a pivotal role in implementing cutting-edge technologies that streamline operations. His forward-thinking and innovative mindset have driven transformative changes, resulting in significant efficiency gains and productivity improvements. Bob’s strategic thinking and commitment to progress have not only enhanced organizational efficiency but also had a substantial impact on the company's bottom line. His contributions are instrumental in driving operational success and reflect his dedication to advancing the organization’s goals.",2024-10-21 10:40:57.415,2024-10-21 10:40:59.653,2.23816
,,,,,,question2,"Bob exemplifies strong leadership by consistently seeking improvement and inspiring his team to excel. He fosters a culture of innovation, encouraging team members to contribute ideas and take initiative, which enhances morale and engagement. By creating an environment where new ideas are welcomed, Bob empowers his team to take risks and experiment. His leadership promotes a dynamic team atmosphere that challenges the status quo and encourages creative thinking. Overall, Bob's project management skills significantly impact the team's performance, aligning with the company's core values and contributing positively to its success.",2024-10-21 10:40:59.654,2024-10-21 10:41:01.369,1.715084
,,,,,,question3,"Bob's leadership and project management can be significantly enhanced by improving his communication and time management skills. By clearly articulating ideas and strategies, he will align his vision with team objectives, fostering better collaboration and understanding among stakeholders and team members. Effective time management will enable him to handle multiple projects efficiently, ensuring timely delivery without sacrificing quality, thereby boosting overall productivity. These improvements will enhance Bob’s impact on the team and contribute positively to the company’s success.",2024-10-21 10:41:01.369,2024-10-21 10:41:02.988,1.618849
,,,,,,question4,"Bob should enhance his strategic planning skills to proactively manage projects and navigate industry complexities, positioning his team for future success. Improving his leadership abilities will enable him to effectively mentor junior team members, fostering the next generation of leaders and contributing to overall team development. His focus on these areas will have a positive impact on both the team and the company by ensuring readiness for challenges and seizing opportunities, ultimately supporting long-term success.",2024-10-21 10:41:02.989,2024-10-21 10:41:05.513,2.524082
Carol White,Level 1,Manager,IR,Saqib,105.0,question1,"Carol consistently demonstrates exceptional leadership and project management skills by proactively identifying new business opportunities, significantly boosting revenue and aligning with company objectives. Her keen market insight and initiative have greatly enhanced team success and contributed to the firm’s growth trajectory. Carol's strategic contributions reflect her ability to recognize and act on potential growth areas, making her an invaluable asset to the organization.",2024-10-21 10:41:05.513,2024-10-21 10:41:06.930,1.417134
,,,,,,question2,"She consistently demonstrates strong leadership and project management skills by being proactive and solution-oriented, aligning her actions with the firm's strategic objectives. Her initiative in driving results enhances team performance, boosts morale, and improves productivity. By actively seeking solutions and improving processes, she serves as a role model for her colleagues, making her a valuable asset to the team and organization. Her contributions significantly impact overall company performance by embodying core values and fostering an environment of continuous improvement.",2024-10-21 10:41:06.930,2024-10-21 10:41:09.856,2.925355
,,,,,,question3,"Carol is a promising leader whose potential can be further unlocked by enhancing her negotiation and analytical skills. Strengthening her negotiation abilities will enable her to secure favorable terms with clients, fostering strong relationships and driving the firm’s success. Improving her analytical skills will allow her to better understand market trends and make informed decisions, aligning with the firm’s strategic goals. These improvements will position Carol as a knowledgeable leader, significantly impacting the team and contributing to the company's ongoing success. Her development in these areas is crucial for sustained positive outcomes and organizational growth.",2024-10-21 10:41:09.857,2024-10-21 10:41:11.962,2.105434
,,,,,,question4,"Carol's advancement hinges on enhancing her leadership and project management skills. By developing her leadership abilities, she will be better equipped to mentor and inspire her team, driving them toward collective goals. Strengthening her project management skills will enable her to effectively lead initiatives from start to finish, ensuring alignment with the firm's objectives. These improvements will prepare Carol for more significant responsibilities, positioning her for future advancement and making a substantial impact on the team and company.",2024-10-21 10:41:11.962,2024-10-21 10:41:13.559,1.597055
Jane Doe,Level 4,Senior Analyst,IR,Saqib,101.0,question1,"Jane demonstrates exceptional leadership and project management skills, driving significant successes for the company. Her strategic mindset led a major project to a 20% sales increase, showcasing her ability to deliver results and align team efforts with organizational goals. Jane's interpersonal skills were crucial in securing a major client, highlighting her dedication to relationship-building. Her strong analytical abilities and attention to detail have boosted client satisfaction. Consistently exceeding sales targets, Jane's innovative problem-solving and creative strategies have enhanced the firm's market presence and bottom line, reflecting her strong work ethic and impactful contributions to the team and company.",2024-10-21 10:41:13.560,2024-10-21 10:41:15.319,1.759154
,,,,,,question2,"Jane’s leadership and project management skills significantly enhance team dynamics and company success. Her proactive approach and eagerness to take on additional responsibilities inspire her teammates, while her ability to create a collaborative environment fosters creativity. Actively seeking feedback, Jane promotes continuous improvement and personal growth within the team. Her dedication to exceeding expectations strengthens work ethic, boosts team morale, and improves client satisfaction. By maintaining positive relationships, she elevates team spirit. Jane's drive for excellence sets a high standard, encouraging colleagues to achieve their goals and overcome challenges, thus cultivating a culture of success within the company.",2024-10-21 10:41:15.320,2024-10-21 10:41:17.466,2.145452
,,,,,,question3,"To enhance her leadership and project management skills, Jane should build confidence in decision-making for complex projects and actively participate in strategic discussions. Improving her public speaking abilities will help her communicate effectively with stakeholders, amplifying her impact. By enhancing technical skills, particularly in data analysis and reporting, Jane can offer stronger support to her team, boosting overall performance. Embracing opportunities to present ideas will foster better collaboration and decision-making among peers. Engaging in workshops or speaking clubs could further develop these skills, positioning Jane as a more influential contributor to the team and company.",2024-10-21 10:41:17.466,2024-10-21 10:41:19.460,1.994317
,,,,,,question4,"Jane should enhance her networking to gain diverse insights, enriching her contributions. Focusing on strategic thinking will prepare her for leadership by aligning team efforts with long-term goals and anticipating market trends. Building leadership capabilities will enable Jane to assume greater responsibilities and positively influence team dynamics. Her ability to foresee challenges and identify growth opportunities is crucial for her development as a future leader, impacting both the team and the company positively.",2024-10-21 10:41:19.460,2024-10-21 10:41:20.711,1.25119
John Smith,Level 3,Assistant Managing Director,CS,Tiju,102.0,question1,"John consistently exceeds sales targets, demonstrating leadership and project management skills. His strategic client engagement and innovative onboarding process improved customer satisfaction and operational efficiency. John's expertise in client relations and negotiation skills secured high-profile clients, enhancing the firm’s reputation and opening new opportunities. His results-driven approach significantly contributes to the team's success and competitive edge.",2024-10-21 10:41:20.712,2024-10-21 10:41:22.109,1.396604
,,,,,,question2,"John exemplifies strong leadership and project management skills by prioritizing customer satisfaction and fostering a collaborative team environment. His ability to align team members with common goals enhances client relationships and cultivates trust and loyalty. By sharing knowledge, John empowers colleagues, contributing to their growth and the organization's overall performance. His leadership ensures that client needs are addressed effectively, embodying core company values and driving team success. John's impact is evident in the unified team spirit he fosters, benefiting both the team and company through improved client satisfaction and alignment with organizational objectives.",2024-10-21 10:41:22.109,2024-10-21 10:41:24.115,2.006265
,,,,,,question3,"John is encouraged to enhance his project management skills to handle larger accounts and complex projects efficiently, ensuring timely and quality outcomes. This development will empower him to navigate challenges with greater impact, benefiting both clients and the company. Additionally, improving technical skills will deepen his understanding of client needs, allowing him to offer more effective solutions and strengthen client relationships. Overall, these improvements in leadership and project management will significantly enhance John's contributions to the team and company, driving successful outcomes for clients.",2024-10-21 10:41:24.115,2024-10-21 10:41:26.217,2.10126
,,,,,,question4,"John's strategic thinking and leadership development are essential for his future roles, enabling him to guide his team effectively and make impactful decisions. By enhancing these skills, he can mentor junior team members, fostering their growth and contributing to overall team success. Improving his negotiation skills will also prepare him to handle larger deals confidently, securing favorable terms for both the firm and its clients. These improvements will be crucial for his career progression, allowing him to take on greater responsibilities and drive strategic initiatives, ultimately benefiting the company’s success.",2024-10-21 10:41:26.218,2024-10-21 10:41:27.928,1.710289
